tags;question;answer
theater;"Какие театры есть в Ростовской области?; Какие музеи есть в Ростовской области?; Какие библиотеки есть в Ростовской области?;";"В Ростовской области есть множество культурных учреждений, включая театры, музеи, библиотеки и другие. Например мультимедийный музей «Россия — моя история», Музей современного изобразительного искусства на Дмитровской, Ростовский областной музей изобразительных искусств, Ростовский музыкальный театр, Театр драмы имени Горького, Ростовский академический молодежный театр, Донская государственная публичная библиотека, а ещё Культурно-выставочный центр «Донская казачья гвардия» - единственный центр в стране, представляющий экспозицию о казаках-гвардейцах, телохранителях российских императоров.;"
teams;"Какие есть известные ростовские спортивные команды?; Какие спортивные команды есть в Ростовской области?; Какие спортивные коллективы есть в Ростове?;";"В Ростовской области базируются различные спортивные команды, включая футбольные клубы ""Ростов"" и ""СКА"", хоккейный клуб ""Ростов"", гандбольный клуб ""Ростов-Дон"" и другие;"
humans;"Сколько людей живет в Ростове-на-Дону?; Сколько жителей в Ростове-на-Дону?;";"Численность населения Ростова-на-Дону составляет примерно 1,1 миллиона человек.;"
main_river;"Какая главная река протекает через Ростов-на-Дону?; Как называется главная река, протекающая через город Ростов-на-Дону?;";"Главная река, протекающая через Ростов-на-Дону, - река Дон.;"
theater;"Какие знаменитые театры есть в Ростове-на-Дону?; Какие театры посетить в Ростове-на-Дону?;";"Знаменитый театр в Ростове-на-Дону - Ростовский академический академический театр драмы имени Максима Горького. Представляет собой уникальный образец театрального здания в стиле советского конструктивизма. Театр расположен на площади, объединившей Ростов и бывшую Нахичевань на рубеже 20-х и 30-х годов XX века. Здание является памятником архитектуры федерального значения, охраняется ЮНЕСКО. В настоящее время макет театра находится в Британском музее, как яркий образец конструктивизма в архитектуре.;"
climate;"Какой климат в Ростове-на-Дону?; Какая погода обычно в Ростове-на-Дону?;";"В Ростове-на-Дону царит умеренно-континентальный климат, характеризующийся жарким летом и мягкой зимой.;"
popular;"Популярен ли Ростов у туристов?; Почему Ростов-на-Дону популярен у туристов?;";"Ростов-на-Дону является популярным туристическим направлением, известным своим культурным наследием, оживленной ночной жизнью и красивыми парками.;"
skate;"Можно ли в Ростовской области прокатиться на байдарках и сапах?;";"В Ростовской области много интересных маршрутов для сплавов. Например, от станицы Кочетовская до станицы Раздорская. Кстати, знали, что станица Раздорская - родина Донского казачества? Также простые водные маршруты от станицы Пухляковская до станицы Мелиховская. Пляжи с песочком, тихий Дон, бескрайние просторы - лЮбо! А для любителей активного отдыха в Ростове-на-Дону можно порекомендовать устроить сплав на сапборде прямо на левом берегу Дона.;"
skate_2;"Где покататься на велосипеде в  Ростовской области?;";"Покататься на велосипеде можно в парке Левобережном, Кумженской Роще, Щепкинском лесу, Парке Островского, на улице Береговой, парке Революции, парке имени Горького;"
piknik;"Где лучше всего устроить пикник в Ростове-на-Дону?;";"Лучше успроить пикник в Парке Островского, парке Левобережном, улице Береговой, парке Революции, парке имени Горького, роще на Орской, Зелёном острове;"
evening;"Куда поехать вечером в пятницу в Ростове-на-Дону?; Где отдохнуть в пятницу вечером в Ростове?;";"Барная миля – направляемся по переулку Газетному от улицы Станиславского и двигаемся в сторону Севера: бары и заведения на улицах Шаумяна, Суворова, Максима Горького ждут всех желающих!Отправиться в рестораны и заведения Ростова-на-Дону, некоторые заведения регулярно входят в топ гастрономических локаций в России. Гостям также рекомендуется отведать знаменитую Ростовскую шаурму в магазинах и кафе недалеко от Центральной Городской Больницы и посидеть с друзьями в чайной, как это делал Баста!;"
weekend;"Где провести выходные с палаткой в Ростовской области?;";"Павло-Очаковская коса, Прохоровские скалы, Зайцевские скалы;"
place_act;"Места в Ростовской области для активного отдыха?;";"Кайтсёрфинг на Павло-очаковской косе, дрифт-такси в селе Султан-Салы, прыжки с парашютом в Азовском районе, флайборд в Ростове-на-Дону, творческий мастер-класс с казаком в Ростове-на-Дону, станице Старочеркасской или хуторе Старозолотовский.;"
unusual_museum;"Какой необычный музей есть в Ростове;";"В Ростове-на-Дону много интересных музеев и уникальных экспозиций, но особого внимания заслуживает культурно-выставочный центр «Донская казачья гвардия» - единственная в России экспозиция, посвященная казакам, охранявших российских императоров. Еще один такой музей есть только в Париже.;"
horse;"Где увидеть донских лошадей?;";"САмый красивый представитель -я, конь Тидон. Остальных моих братьев можно увидеть например на Территории Дончаков Гелиос; Донской природный заповедник: В этом природном заповеднике можно встретить диких донских лошадей, которые живут в своей естественной среде.;"
deer;"Есть ли олени в Ростовской области?;";"Да, например, в Александровском лесуВ оленьем питомнике в Усть-донецком районе;"
turist;"Какой турпоток в Ростовской области?; Сколько туристов в Ростовской области?;";"Ростовскую область за 2022 год посетило почти 4 миллиона туристов;"
tur ;"Как купить тур в Ростов?; Где купить тур в Ростовскую область?; Как купить тур?;";"Купить тур в Ростовскую область можно на официальном сайте visitdon.ru в разделе ""Купить тур"";"
virtual excursions;"Где посмотреть виртуальные экскурсии про Ростовской области?;";"Совершить виртуальную экскурсию можно на официальном сайте visitdon.ru в разделе ""Виртуальные туры по региону"";"
What_to_bring;"Что привезти из Ростова?; Что привезти из Ростовской области?; Какой сувенир привести из Ростова?; Какой сувенир привести из Ростовской области?;";"Из Ростова непременно стоит привезти сувениры с казачьей тематикой: статуэтки, посуду со сценками из станичной жизни, донскую рыбу, сыры, мясные деликатесы и конечно же бутылочку донского вина, сделанного по старинным казачьим рецептам;"
stop;"Где остановиться отдохнуть по пути на море?;";"По дороге на юг на территории Ростовской области можно остановиться на отдых в многочисленных гостиницах и мотелях, расположенных вблизи автодороги М-4 ""Дон"" или в одном из комплексов Транспарк.;"
excursion;"Как попасть на экскурсию на стадион Ростов-Арена?; Можно ли посмотреть на стадион в Ростове изнутри?;";"Посмотреть Ростов-Арену можно не только во время матчей. На стадионе проводятся экскурсии по предварительной записи. Можно оставить заявку на сайте rnd-arena.ru;"
fest;"Какие фестивали и праздники посетить?; Какие фестивали проходят?; Какие праздники стоит посетить?;";"В Ростовской области ежегодно проходит большое количество фестивалей и праздников! Весной обязательно стои посетить  литературно-фольклорный фестиваль «Шолоховская весна», летом - гастрономический праздник «Донская уха», фестиваль посвященный актрисе Фаине Раневской «Зонтичное утро», военно-исторических фестивали «Оборона Таганрога 1855 года» и «Осада Азова», осенью - этнографический фестиваль «Донская лоза».;"
unusual;"Что необычного можно увидеть в Ростовской области?; Что особенного есть в Ростовской области?;";"Можно посмотреть на донских мустангов - это одно из чудес Ростовской области. Отправляйтесь в Государственный Биосферный заповедник «Ростовский» на остров Водный. Рекомендую выбирать начало апреля - совместить поездку с цветением тюльпанов и фестивалем «Воспетая степь»;"
mustang;"Где увидеть донских мустангов?; Какие места подходят для наблюдения за донскими мустангами?; Где можно встретить диких донских лошадей?; В каких регионах можно увидеть донских мустангов?; Где обитают донские мустанги?; Как найти донских мустангов в природе?; Где можно ознакомиться с дикими донскими лошадьми?; Какие места предоставляют возможность увидеть донских мустангов в России?; Где можно пронаблюдать диких лошадей в Ростовской области?; Какие природные заповедники или парки подходят для наблюдения за донскими мустангами?; Где находятся места обитания донских лошадей в Ростовской области?; Как дойти до мест, где можно увидеть донских мустангов?; Какие экскурсии предлагают возможность встретить донских мустангов?; Где проводятся туры для наблюдения за донскими лошадьми?; Где можно совершить конные поездки с целью увидеть донских мустангов?; Какие местные организации занимаются исследованием донских мустангов и могут предоставить информацию о местонахождении?; Как найти дикую природу, где обитают донские мустанги?;";"Отправляйтесь в Государственный Биосферный заповедник «Ростовский» на остров Водный. Рекомендую выбирать начало апреля - совмещать поездку с цветением тюльпанов и фестивалем «Воспетая степь»; Различные конюшни и фермы в Азовском районе Ростовской области могут предоставить вам возможность увидеть донских мустангов;В Ростовской области есть множество конных клубов и ферм, которые содержат донских мустангов для конных прогулок и экскурсий;На местных фестивалях и мероприятиях, посвященных культуре и истории Ростовской области, иногда можно увидеть выступления с донскими мустангами; Некоторые природные заповедники и заказники в регионе также могут иметь диких донских мустангов. Однако, для их наблюдения в дикой природе, возможно, потребуется организовать специальные экскурсии;"
vine_1;"В Ростовской области делают вино?; Производят ли в Ростовской области винное производство?; В Ростовской области занимаются виноделием?; Есть ли в Ростовской области винные плантации?; Имеется ли в Ростовской области винодельческая промышленность?; В Ростовской области изготавливают вино?; Занимаются ли в Ростовской области виноделием и винотворчеством?; В Ростовской области производят алкогольные напитки, включая вино?; Местная экономика Ростовской области включает виноделие?; В Ростовской области имеются винные заводы?; Существует ли в Ростовской области традиция виноделия?; В Ростовской области изготавливают винные напитки?; Есть ли в Ростовской области винные мастерские?; Какова роль Ростовской области в виноделии?;";"Да, Ростовская область знаменита своими виноделами. В Ростовской области несколько автохтонных сортов винограда, но самые популярные сорта: краснотоп золотовский – красный сорт для любителей вина с характером и сибирьковый – белый сорт, с яркой ароматикой и фруктовыми нотками; Да, в Ростовской области производят вино. Ростовская область известна своими винодельческими предприятиями, которые производят различные сорта вин, включая красное, белое и игристое вино. В регионе есть виноградники и винодельни, которые специализируются на производстве вина. Благоприятный климат и почвы Ростовской области способствуют выращиванию винограда и производству высококачественного вина.;"
vine;"Из какого винограда делают донское вино?; Какие сорта винограда используются для производства донского вина?; Какой виноград является основным ингредиентом в донском вине?; Какие виды винограда предпочтительны для создания донских вин?; Какой сорт винограда наиболее популярен в виноделии Ростовской области?; Из каких сортов винограда изготавливают донское вино?; Какие виноградные сорта наиболее характерны для донских вин?; Какие сорта винограда подходят для создания донских винных брендов?; С какими сортами винограда ассоциируется донское вино?; Какие виды винограда процветают в климате Ростовской области?; Какой сорт винограда является традиционным для донских виноделов?; Какие сорта винограда лучше всего растут в почвах Ростовской области?; Какие сорта винограда наиболее пригодны для производства донского вина?; С какими виноградными сортами ассоциируется винодельческая культура Ростовской области?; Какие сорта винограда отличают донские вина от других регионов?; Из каких сортов винограда изготавливают вино в Ростовской области?;";"В Ростовской области несколько автохтонных сортов винограда, но самые популярные сорта: краснотоп золотовский – красный сорт для любителей вина с характером и сибирьковый – белый сорт, с яркой ароматикой и фруктовыми нотками.;"
sea;"В Ростовской области есть море?; Имеется ли водоем, подходящий для купания, в Ростовской области?; Можно ли найти морское побережье в Ростовской области?; Есть ли доступ к морю в Ростовской области?; Можно ли купаться в Ростовской области?; Есть ли пляжи в Ростовской области?; Возможно ли совершать морские прогулки в Ростовской области?; Где находится водоем, на котором можно купаться, в Ростовской области?; Есть ли прибрежные города или поселки в Ростовской области?; Можно ли насладиться морскими видами в Ростовской области?; Есть ли возможность заниматься водными видами спорта в Ростовской области?; Какие прибрежные развлечения доступны в Ростовской области?;";"Конечно, в Ростовской области есть Азовское море и выход к нему имеет чудесный город Таганрог, который уже несколько сезонов в Таганрогском заливе принимает круизные теплоходы. Море довольно мелкое и теплое, поэтому здесь есть отличные места для отдыха с детьми, а недалеко от города в Неклиновском районе есть детские лагеря, которые каждый сезон ждут ребят разного возраста на каникулы.;"
glamlang;"Где в Ростовской области есть глэмпинги?; А есть глэмпинги?; Где отдохнуть на природе?; Какие места в Ростовской области предлагают глэмпинг?; Где можно найти глэмпинг-лагеря в Ростовской области?; Какие пункты назначения в Ростовской области предоставляют услуги глэмпинга?;";"Отдых на природе сейчас очень популярен, вы можете выбрать глэмпинги Неклиновского района (глэпминги «Просто лес» или «River Glamp») – отдых в лесу или на берегу реки, или отправиться в Усть-Донецкий и Константиновский район (глэмпинг «Три воды» и «Синий Яр») – здесь вас ждет настоящая природа донской степи. ;"
